Title,URL,Description,Details,ShortDetails,Resource,Type,Identifiers,Db,EntrezUID,Properties
"Antiretroviral treatment regimen outcomes among HIV-infected prisoners.","/pubmed/17720660","Springer SA, Friedland GH, Doros G, Pesanti E, Altice FL.","HIV Clin Trials. 2007 Jul-Aug;8(4):205-12.","HIV Clin Trials.  2007","PubMed","citation","PMID:17720660 | PMCID:PMC2409059","pubmed","17720660","create date:2007/08/28 | first author:Springer SA",
"A randomized, open-label, crossover study comparing the effects of oral versus transdermal estrogen therapy on serum androgens, thyroid hormones, and adrenal hormones in naturally menopausal women.","/pubmed/17507833","Shifren JL, Desindes S, McIlwain M, Doros G, Mazer NA.","Menopause. 2007 Nov-Dec;14(6):985-94.","Menopause.  2007","PubMed","citation","PMID:17507833","pubmed","17507833","create date:2007/05/18 | first author:Shifren JL",
"Unit bias. A new heuristic that helps explain the effect of portion size on food intake.","/pubmed/16771803","Geier AB, Rozin P, Doros G.","Psychol Sci. 2006 Jun;17(6):521-5.","Psychol Sci.  2006","PubMed","citation","PMID:16771803","pubmed","16771803","create date:2006/06/15 | first author:Geier AB",
"Recent treatment history vs clinical characteristics in the prediction of use of outpatient psychiatric services.","/pubmed/16374531","de Figueiredo JM, Boerstler H, Doros G.","Soc Psychiatry Psychiatr Epidemiol. 2006 Feb;41(2):130-9.","Soc Psychiatry Psychiatr Epidemiol.  2006","PubMed","citation","PMID:16374531","pubmed","16374531","create date:2005/12/24 | first author:de Figueiredo JM",
"Probability of replication revisited: comment on ""An alternative to Null-Hypothesis Significance Tests."".","/pubmed/16313667","Doros G, Geier AB.","Psychol Sci. 2005 Dec;16(12):1005-6. No abstract available. ","Psychol Sci.  2005","PubMed","citation","PMID:16313667","pubmed","16313667","create date:2005/11/30 | first author:Doros G",
"Effectiveness of antiretroviral therapy among HIV-infected prisoners: reincarceration and the lack of sustained benefit after release to the community.","/pubmed/15227623","Springer SA, Pesanti E, Hodges J, Macura T, Doros G, Altice FL.","Clin Infect Dis. 2004 Jun 15;38(12):1754-60.","Clin Infect Dis.  2004","PubMed","citation","PMID:15227623","pubmed","15227623","create date:2004/07/01 | first author:Springer SA",
