Title,URL,Description,Details,ShortDetails,Resource,Type,Identifiers,Db,EntrezUID,Properties
"BK virus nephropathy in renal transplant patients in London.","/pubmed/18408582","White LH, Casian A, Hilton R, Macphee IA, Marsh J, Sweny P, Trevitt R, Frankel AH, Warrens AN; Pan-Thames Renal Audit Group..","Transplantation. 2008 Apr 15;85(7):1008-15. doi: 10.1097/TP.0b013e31816a32fc.","Transplantation.  2008","PubMed","citation","PMID:18408582","pubmed","18408582","create date:2008/04/15 | first author:White LH",
"Effects of presentation and electrocardiogram on time to treatment of hyperkalemia.","/pubmed/18304054","Freeman K, Feldman JA, Mitchell P, Donovan J, Dyer KS, Eliseo L, White LF, Temin ES.","Acad Emerg Med. 2008 Mar;15(3):239-49. doi: 10.1111/j.1553-2712.2008.00058.x.","Acad Emerg Med.  2008","PubMed","citation","PMID:18304054","pubmed","18304054","create date:2008/02/29 | first author:Freeman K",
"Transmissibility of the influenza virus in the 1918 pandemic.","/pubmed/18231585","White LF, Pagano M.","PLoS One. 2008 Jan 30;3(1):e1498. doi: 10.1371/journal.pone.0001498.","PLoS One.  2008","PubMed","citation","PMID:18231585 | PMCID:PMC2204055","pubmed","18231585","create date:2008/01/31 | first author:White LF",
"A two-phase innate host response to alphavirus infection identified by mRNP-tagging in vivo.","/pubmed/18215114","Konopka JL, Penalva LO, Thompson JM, White LJ, Beard CW, Keene JD, Johnston RE.","PLoS Pathog. 2007 Dec;3(12):e199. doi: 10.1371/journal.ppat.0030199.","PLoS Pathog.  2007","PubMed","citation","PMID:18215114 | PMCID:PMC2151086","pubmed","18215114","create date:2008/01/25 | first author:Konopka JL",
"Effect of spatial resolution on cluster detection: a simulation study.","/pubmed/18042281","Ozonoff A, Jeffery C, Manjourides J, White LF, Pagano M.","Int J Health Geogr. 2007 Nov 27;6:52.","Int J Health Geogr.  2007","PubMed","citation","PMID:18042281 | PMCID:PMC2213641","pubmed","18042281","create date:2007/11/29 | first author:Ozonoff A",
"An immunogenic and protective alphavirus replicon particle-based dengue vaccine overcomes maternal antibody interference in weanling mice.","/pubmed/17652394","White LJ, Parsons MM, Whitmore AC, Williams BM, de Silva A, Johnston RE.","J Virol. 2007 Oct;81(19):10329-39.","J Virol.  2007","PubMed","citation","PMID:17652394 | PMCID:PMC2045445","pubmed","17652394","create date:2007/07/27 | first author:White LJ",
"In vivo imaging of disturbed pre- and post-synaptic dopaminergic signaling via arachidonic acid in a rat model of Parkinson's disease.","/pubmed/17681816","Bhattacharjee AK, Meister LM, Chang L, Bazinet RP, White L, Rapoport SI.","Neuroimage. 2007 Oct 1;37(4):1112-21.","Neuroimage.  2007","PubMed","citation","PMID:17681816 | PMCID:PMC2040339","pubmed","17681816","create date:2007/08/08 | first author:Bhattacharjee AK",
"Nonnucleoside inhibitor of measles virus RNA-dependent RNA polymerase complex activity.","/pubmed/17470652","White LK, Yoon JJ, Lee JK, Sun A, Du Y, Fu H, Snyder JP, Plemper RK.","Antimicrob Agents Chemother. 2007 Jul;51(7):2293-303.","Antimicrob Agents Chemother.  2007","PubMed","citation","PMID:17470652 | PMCID:PMC1913224","pubmed","17470652","create date:2007/05/02 | first author:White LK",
"Transcriptional activation of interferon-stimulated genes but not of cytokine genes after primary infection of rhesus macaques with dengue virus type 1.","/pubmed/17428947","Sariol CA, Muñoz-Jordán JL, Abel K, Rosado LC, Pantoja P, Giavedoni L, Rodriguez IV, White LJ, Martínez M, Arana T, Kraiselburd EN.","Clin Vaccine Immunol. 2007 Jun;14(6):756-66.","Clin Vaccine Immunol.  2007","PubMed","citation","PMID:17428947 | PMCID:PMC1951081","pubmed","17428947","create date:2007/04/13 | first author:Sariol CA",
"Teaching students behavior change skills: description and assessment of a new Motivational interviewing curriculum.","/pubmed/17786734","White LL, Gazewood JD, Mounsey AL.","Med Teach. 2007 May;29(4):e67-71.","Med Teach.  2007","PubMed","citation","PMID:17786734","pubmed","17786734","create date:2007/09/06 | first author:White LL",
"Highly efficient synthesis of tricyclic amines by a cyclization/cycloaddition cascade: total syntheses of aspidospermine, aspidospermidine, and quebrachamine.","/pubmed/17623291","Coldham I, Burrell AJ, White LE, Adams H, Oram N.","Angew Chem Int Ed Engl. 2007;46(32):6159-62. No abstract available. ","Angew Chem Int Ed Engl.  2007","PubMed","citation","PMID:17623291","pubmed","17623291","create date:2007/07/12 | first author:Coldham I",
"Differential induction of type I interferon responses in myeloid dendritic cells by mosquito and mammalian-cell-derived alphaviruses.","/pubmed/17079324","Shabman RS, Morrison TE, Moore C, White L, Suthar MS, Hueston L, Rulli N, Lidbury B, Ting JP, Mahalingam S, Heise MT.","J Virol. 2007 Jan;81(1):237-47.","J Virol.  2007","PubMed","citation","PMID:17079324 | PMCID:PMC1797231","pubmed","17079324","create date:2006/11/03 | first author:Shabman RS",
"D-Amphetamine stimulates D2 dopamine receptor-mediated brain signaling involving arachidonic acid in unanesthetized rats.","/pubmed/16511499","Bhattacharjee AK, Chang L, White L, Bazinet RP, Rapoport SI.","J Cereb Blood Flow Metab. 2006 Nov;26(11):1378-88.","J Cereb Blood Flow Metab.  2006","PubMed","citation","PMID:16511499","pubmed","16511499","create date:2006/03/03 | first author:Bhattacharjee AK",
"Do students develop better motivational interviewing skills through role-play with standardised patients or with student colleagues?","/pubmed/16869923","Mounsey AL, Bovbjerg V, White L, Gazewood J.","Med Educ. 2006 Aug;40(8):775-80.","Med Educ.  2006","PubMed","citation","PMID:16869923","pubmed","16869923","create date:2006/07/28 | first author:Mounsey AL",
"Survival outcomes in node-negative breast cancer patients evaluated with complete axillary node dissection versus sentinel lymph node biopsy.","/pubmed/16538416","Cox C, White L, Allred N, Meyers M, Dickson D, Dupont E, Cantor A, Ly Q, Dessureault S, King J, Nicosia S, Vrcel V, Diaz N.","Ann Surg Oncol. 2006 May;13(5):708-11.","Ann Surg Oncol.  2006","PubMed","citation","PMID:16538416","pubmed","16538416","create date:2006/03/16 | first author:Cox C",
"Sentinel node biopsy before neoadjuvant chemotherapy for determining axillary status and treatment prognosis in locally advanced breast cancer.","/pubmed/16523361","Cox CE, Cox JM, White LB, Stowell NG, Clark JD, Allred N, Meyers M, Dupont E, Furman B, Minton S.","Ann Surg Oncol. 2006 Apr;13(4):483-90.","Ann Surg Oncol.  2006","PubMed","citation","PMID:16523361","pubmed","16523361","create date:2006/03/09 | first author:Cox CE",
"Two domains that control prefusion stability and transport competence of the measles virus fusion protein.","/pubmed/16415028","Doyle J, Prussia A, White LK, Sun A, Liotta DC, Snyder JP, Compans RW, Plemper RK.","J Virol. 2006 Feb;80(3):1524-36.","J Virol.  2006","PubMed","citation","PMID:16415028 | PMCID:PMC1346935","pubmed","16415028","create date:2006/01/18 | first author:Doyle J",
"Older adults' desire for physical competence.","/pubmed/16394960","Rejeski WJ, Ip EH, Katula JA, White L.","Med Sci Sports Exerc. 2006 Jan;38(1):100-5.","Med Sci Sports Exerc.  2006","PubMed","citation","PMID:16394960","pubmed","16394960","create date:2006/01/06 | first author:Rejeski WJ",
"An update of sentinel lymph node mapping in patients with ductal carcinoma in situ.","/pubmed/16164920","Wilkie C, White L, Dupont E, Cantor A, Cox CE.","Am J Surg. 2005 Oct;190(4):563-6.","Am J Surg.  2005","PubMed","citation","PMID:16164920","pubmed","16164920","create date:2005/09/17 | first author:Wilkie C",
"Development and validation of a lower-extremity activity scale. Use for patients treated with revision total knee arthroplasty.","/pubmed/16140813","Saleh KJ, Mulhall KJ, Bershadsky B, Ghomrawi HM, White LE, Buyea CM, Krackow KA.","J Bone Joint Surg Am. 2005 Sep;87(9):1985-94.","J Bone Joint Surg Am.  2005","PubMed","citation","PMID:16140813","pubmed","16140813","create date:2005/09/06 | first author:Saleh KJ",
"Accuracy of intraoperative imprint cytology for sentinel lymph node evaluation in the treatment of breast carcinoma.","/pubmed/15605359","Cox C, Centeno B, Dickson D, Clark J, Nicosia S, Dupont E, Greenberg H, Stowell N, White L, Patel J, Furman B, Cantor A, Hakam A, Ahmad N, Diaz N, King J.","Cancer. 2005 Feb 25;105(1):13-20.","Cancer.  2005","PubMed","citation","PMID:15605359","pubmed","15605359","create date:2004/12/18 | first author:Cox C",
"Selective sentinel lymphadenectomy for breast cancer.","/pubmed/16209078","Cox CE, Weinberg ES, Furman B, White LB, Patel J, Dickson DC, King J.","Cancer Treat Res. 2005;127:77-104. Review. No abstract available. ","Cancer Treat Res.  2005","PubMed","citation","PMID:16209078","pubmed","16209078","create date:2005/10/08 | first author:Cox CE",
"Cytokeratin staining for intraoperative evaluation of sentinel lymph nodes in patients with invasive lobular carcinoma.","/pubmed/15474439","Weinberg ES, Dickson D, White L, Ahmad N, Patel J, Hakam A, Nicosia S, Dupont E, Furman B, Centeno B, Cox C.","Am J Surg. 2004 Oct;188(4):419-22.","Am J Surg.  2004","PubMed","citation","PMID:15474439","pubmed","15474439","create date:2004/10/12 | first author:Weinberg ES",
"Local recurrence in lumpectomy patients after imprint cytology margin evaluation.","/pubmed/15474425","Weinberg E, Cox C, Dupont E, White L, Ebert M, Greenberg H, Diaz N, Vercel V, Centeno B, Cantor A, Nicosia S.","Am J Surg. 2004 Oct;188(4):349-54. Review.","Am J Surg.  2004","PubMed","citation","PMID:15474425","pubmed","15474425","create date:2004/10/12 | first author:Weinberg E",
"Hyaluronan suppresses epidermal differentiation in organotypic cultures of rat keratinocytes.","/pubmed/15149843","Passi A, Sadeghi P, Kawamura H, Anand S, Sato N, White LE, Hascall VC, Maytin EV.","Exp Cell Res. 2004 Jun 10;296(2):123-34.","Exp Cell Res.  2004","PubMed","citation","PMID:15149843","pubmed","15149843","create date:2004/05/20 | first author:Passi A",
"Clinical considerations in breast cancer sentinel lymph node mapping: a Moffitt review.","/pubmed/15550840","Cox CE, White L, Stowell N, Clark J, Dickson D, Furman B, Weinberg E, Jakub J, Dupont E.","Breast Cancer. 2004;11(3):225-32; discussion 264-6. Review.","Breast Cancer.  2004","PubMed","citation","PMID:15550840","pubmed","15550840","create date:2004/11/20 | first author:Cox CE",
"An attenuating mutation in nsP1 of the Sindbis-group virus S.A.AR86 accelerates nonstructural protein processing and up-regulates viral 26S RNA synthesis.","/pubmed/12502831","Heise MT, White LJ, Simpson DA, Leonard C, Bernard KA, Meeker RB, Johnston RE.","J Virol. 2003 Jan;77(2):1149-56.","J Virol.  2003","PubMed","citation","PMID:12502831 | PMCID:PMC140780","pubmed","12502831","create date:2002/12/28 | first author:Heise MT",
Title,URL,Description,Details,ShortDetails,Resource,Type,Identifiers,Db,EntrezUID,Properties
"Structural requirements for the assembly of Norwalk virus-like particles.","/pubmed/11907243","Bertolotti-Ciarlet A, White LJ, Chen R, Prasad BV, Estes MK.","J Virol. 2002 Apr;76(8):4044-55.","J Virol.  2002","PubMed","citation","PMID:11907243 | PMCID:PMC136079","pubmed","11907243","create date:2002/03/22 | first author:Bertolotti-Ciarlet A",
"Effects of PKR/RNase L-dependent and alternative antiviral pathways on alphavirus replication and pathogenesis.","/pubmed/11952147","Ryman KD, White LJ, Johnston RE, Klimstra WB.","Viral Immunol. 2002;15(1):53-76.","Viral Immunol.  2002","PubMed","citation","PMID:11952147","pubmed","11952147","create date:2002/04/16 | first author:Ryman KD",
